SID,Status,Update Status Date,Start Progress,TOL,Keterangan
100005640001,Pengadaan,21/10/2020,24/10/2020,24/11/2020,Masih Proses Pengadaan
100005240002,MOD,20/09/2020,25/10/2020,25/11/2020,lokasi lain luar Jakarta Teknisi masih menunggu Rapid Test untuk ke lokasi
100005290011,MOD,30/09/2020,26/10/2020,26/11/2020,"Barang di Surabaya, masih menunggu jadwal kapal, pagi ini kami dpt info terbaru kapal tgl 15 juli cancel , team sedang cari alternatif lain, segera kami info jadwal kapal terbaru & lead timenya"
100005290012,Online,25/09/2021,11/11/2020,26/11/2021,Sudah online 42 Lokasi  BA fisik sudah ada 6 Lokasi
100005290013,Pending,24/09/2022,26/10/2022,26/11/2022,teknisinya harus ada tambahan mcu. Teknisi sedang MCU.
100005290014,BAA Diterima,22/09/2023,26/10/2023,26/11/2023,Sudah online BA masih di progres